{"id":"engineering-product-leadership","title":"Engineering Management and Common-Feature Product Leadership","module":"embedded","collection":"embedded-systems-firmware","order":10,"standard":{"family":"AutoLeaP Embedded Systems Body of Knowledge","edition":"2026","parts":["10"],"clauseRefs":["Engineering and Product Leadership"]},"difficulty":"Expert","stage":10,"systems":["Technical Management","Product Ownership","Role Scenarios"],"summary":"Technical and product leadership operate on different but connected artifacts. Technical vision defines desired capabilities and qualities. Architecture strategy defines structural direction and migration. Product roadmap sequences customer and business outcomes. Delivery plans commit teams and dependencies. Confusing these levels creates either abstract strategy with no execution or short-term delivery that destroys future options.","learningObjectives":["Align technical vision, architecture strategy, product roadmap and delivery.","Lead global engineering decisions without centralizing every detail.","Prioritize common features using customer value, reuse, risk and technical integrity."],"explanation":["Technical and product leadership operate on different but connected artifacts. Technical vision defines desired capabilities and qualities. Architecture strategy defines structural direction and migration. Product roadmap sequences customer and business outcomes. Delivery plans commit teams and dependencies. Confusing these levels creates either abstract strategy with no execution or short-term delivery that destroys future options.","An engineering manager creates context, decision rights, capability and sustainable delivery. Senior technical leaders should own domain decisions, while cross-domain risks and irreversible choices receive broader review. Written proposals and architecture decisions support globally distributed teams. Healthy leadership preserves dissent and evidence without reopening every settled decision.","A common-feature product owner owns value and lifecycle across products. Prioritization considers customer impact, business strategy, risk, dependency, reuse leverage and technical feasibility. Technical enablers belong in the product story when they enable sustainable quality, security or delivery cadence. Release content and field results close the loop between roadmap and engineering."],"whyItMatters":["Shared embedded platforms fail when business and engineering decisions are made in separate systems.","Strong leadership turns common architecture into customer value without sacrificing product integrity or team health."],"inputs":["Business and customer objectives","Product-family roadmap","Architecture and platform health","Team capacity and capability","Quality, field and operational evidence"],"activities":["Set vision, principles and decision rights","Prioritize outcomes and architecture enablers","Resolve cross-product and cross-team trade-offs","Manage suppliers, dependencies and release risk","Develop leaders and review sustainable delivery"],"outputs":["Technical strategy and platform roadmap","Prioritized common-feature backlog","Decision and dependency records","Release and residual-risk decisions","Capability, ownership and organizational improvement plan"],"automotiveExample":"A product launch requests a framework fork to meet a branding deadline. The product owner and engineering manager compare customer value, migration cost and platform risk. They approve a configurable UX extension, reject core-service duplication, and schedule the missing platform capability with named ownership and acceptance criteria.","commonMistakes":["Treating product ownership as backlog administration","Making every technical decision centrally","Allowing the loudest stakeholder to define priority","Rewarding heroic delivery while reliability and burnout worsen","Using schedule pressure to suppress unresolved technical risk"],"relatedConcepts":["platform-reuse-variability","performance-security-release","embedded-execution-and-partitioning"],"linkedQuestions":["E10-01","E10-02","E10-03","E10-04","E10-05","E10-06","E10-07","E10-08","E10-09","E10-10"],"references":["Primary platform and processor documentation","AutoLeaP Embedded Systems & Firmware learning baseline"],"source":"content-source/embedded-systems/concepts.json#engineering-product-leadership"}
