{"id":"rtos-concurrency-timing","title":"RTOS Concurrency and Real-Time Timing","module":"embedded","collection":"embedded-systems-firmware","order":4,"standard":{"family":"AutoLeaP Embedded Systems Body of Knowledge","edition":"2026","parts":["4"],"clauseRefs":["RTOS, Concurrency and Timing"]},"difficulty":"Intermediate","stage":4,"systems":["RTOS & Timing","Performance & Reliability"],"summary":"An RTOS provides tasks, priorities, events, timers, synchronization and interrupt integration, but determinism is not automatic. A deadline is met only when execution time, blocking, release jitter, interrupt interference and higher-priority workload remain within a bounded response time. Priority assignment without a system model often produces fragile behavior that fails when diagnostics, logging or communication load changes.","learningObjectives":["Explain scheduling, blocking and interference in an RTOS.","Select synchronization primitives using ownership and timing semantics.","Build a timing argument using worst-case response rather than average utilization."],"explanation":["An RTOS provides tasks, priorities, events, timers, synchronization and interrupt integration, but determinism is not automatic. A deadline is met only when execution time, blocking, release jitter, interrupt interference and higher-priority workload remain within a bounded response time. Priority assignment without a system model often produces fragile behavior that fails when diagnostics, logging or communication load changes.","Mutexes protect owned resources and may use priority inheritance or ceiling protocols. Semaphores signal availability, queues transfer data or ownership, and event flags represent conditions. Each primitive has overflow, timeout and failure semantics that must be designed. Long critical sections, interrupt masking and hidden driver callbacks can dominate the timing path even when the control task itself is short.","Multicore systems add shared cache, memory, interconnect and cross-core synchronization interference. Core separation is not proof of independence. The architecture should allocate budgets, define shared-resource policies and provide tracing that correlates tasks, interrupts and data age across cores."],"whyItMatters":["Average CPU usage can remain low while tail latency violates a hard deadline.","Explicit timing governance prevents later features from consuming invisible shared margin."],"inputs":["Task and interrupt model","Worst-case execution estimates","Periods, jitter and deadlines","Shared resources and synchronization","Hardware contention and multicore topology"],"activities":["Assign execution contexts and priorities","Analyse blocking and response time","Define queue capacities and overload behavior","Measure representative worst-case traces","Create timing regression and budget-change governance"],"outputs":["Task/ISR and resource model","Response-time and interference analysis","Timing budgets and margin ledger","Overload and degraded-mode behavior","Timing test and tracing plan"],"automotiveExample":"A 1 ms actuator task receives sensor data from an ISR and publishes status to diagnostics. Flash logging is moved to a low-priority worker with bounded buffering, while erase operations are prohibited during critical operation. The mutex protecting calibration uses a defined protocol and updates occur only in a controlled mode.","commonMistakes":["Using average execution time as a deadline argument","Lowering a task priority without checking resource ownership","Performing flash or network operations inside critical sections","Assuming separate cores eliminate common-resource interference","Allowing queues to grow without overflow policy"],"relatedConcepts":["processor-memory-data-movement","embedded-linux-platform","performance-security-release"],"linkedQuestions":["E04-01","E04-02","E04-03","E04-04","E04-05","E04-06","E04-07","E04-08","E04-09","E04-10"],"references":["Primary platform and processor documentation","AutoLeaP Embedded Systems & Firmware learning baseline"],"source":"content-source/embedded-systems/concepts.json#rtos-concurrency-timing"}
