{"id":"embedded-linux-platform","title":"Embedded Linux Platform Engineering","module":"embedded","collection":"embedded-systems-firmware","order":5,"standard":{"family":"AutoLeaP Embedded Systems Body of Knowledge","edition":"2026","parts":["5"],"clauseRefs":["Embedded Linux Platform Engineering"]},"difficulty":"Intermediate","stage":5,"systems":["Embedded Linux","Platform Architecture"],"summary":"Embedded Linux is a product platform, not only a kernel. The bootloader, kernel, Device Tree, firmware, root filesystem, init system, services, package composition and update mechanism form one validated release. Kernel boot completion does not equal product readiness; the architecture must define when required devices, services and customer functions are available.","learningObjectives":["Trace Linux boot, device binding and service readiness.","Explain kernel/user-space boundaries and Device Tree responsibilities.","Plan a maintainable long-life Linux distribution and update model."],"explanation":["Embedded Linux is a product platform, not only a kernel. The bootloader, kernel, Device Tree, firmware, root filesystem, init system, services, package composition and update mechanism form one validated release. Kernel boot completion does not equal product readiness; the architecture must define when required devices, services and customer functions are available.","The Linux device model binds device instances to drivers through bus-specific matching. Device Tree describes non-discoverable hardware and resources such as interrupts, clocks, regulators and memory. Drivers should use kernel frameworks rather than hard-coded board knowledge. Probe deferral is a dependency mechanism, but persistent deferral usually reveals missing or circular platform dependencies.","Long-lived products need a kernel and distribution support strategy. Downstream patches, vendor BSP dependencies, CVE intake, reproducible builds, module compatibility and hardware regression require explicit ownership. Yocto or Buildroot assembles the product, but metadata discipline and continuous integration determine whether the system remains reproducible."],"whyItMatters":["Linux defects often emerge at the boundary between hardware, kernel, services and product configuration.","A controlled platform lifecycle is essential when field support lasts longer than the original development program."],"inputs":["Boot and readiness requirements","Board/SoC Linux support","Kernel and distribution baseline","Service and application dependencies","Security and support horizon"],"activities":["Define boot and service dependency graph","Design Device Tree and driver ownership","Choose kernel/module/user-space boundaries","Establish build and patch lifecycle","Instrument scheduler, memory, I/O and boot performance"],"outputs":["Linux platform composition and support policy","Device and driver binding model","Boot/readiness milestones","Update and rollback compatibility rules","Tracing and field-diagnostic design"],"automotiveExample":"A telematics gateway uses an LTS kernel with a small tracked vendor patch set, a read-only A/B root filesystem, and a separate schema-controlled data partition. Device Tree schemas validate board variants. Product readiness is declared only when modem, secure storage and vehicle-network services pass health checks.","commonMistakes":["Treating Device Tree as arbitrary product configuration","Accepting an unsupported vendor kernel without lifecycle cost","Using aggregate CPU statistics to diagnose latency","Loading all drivers as modules without boot dependency analysis","Allowing writable system files to defeat reproducible updates"],"relatedConcepts":["firmware-boot-bsp","android-aaos-platform","connectivity-infotainment-ota"],"linkedQuestions":["E05-01","E05-02","E05-03","E05-04","E05-05","E05-06","E05-07","E05-08","E05-09","E05-10"],"references":["Primary platform and processor documentation","AutoLeaP Embedded Systems & Firmware learning baseline"],"source":"content-source/embedded-systems/concepts.json#embedded-linux-platform"}
