{"id":"android-aaos-platform","title":"Android Platform and Android Automotive Integration","module":"embedded","collection":"embedded-systems-firmware","order":6,"standard":{"family":"AutoLeaP Embedded Systems Body of Knowledge","edition":"2026","parts":["6"],"clauseRefs":["Android Platform and Android Automotive"]},"difficulty":"Intermediate","stage":6,"systems":["Android Platform","AAOS & Infotainment"],"summary":"Android layers product-facing application and framework behavior above Linux. Binder IPC connects applications, system services and vendor services. HAL contracts isolate framework capabilities from hardware-specific implementation, while AIDL defines typed process boundaries. Synchronous IPC, service lifecycle and thread pools are architectural concerns because a slow or cyclic service dependency can freeze unrelated product behavior.","learningObjectives":["Explain Android framework, Binder, HAL/AIDL and application boundaries.","Trace an AAOS vehicle feature through VHAL and car services.","Design permissions, lifecycle, failure handling and product variants."],"explanation":["Android layers product-facing application and framework behavior above Linux. Binder IPC connects applications, system services and vendor services. HAL contracts isolate framework capabilities from hardware-specific implementation, while AIDL defines typed process boundaries. Synchronous IPC, service lifecycle and thread pools are architectural concerns because a slow or cyclic service dependency can freeze unrelated product behavior.","Android Automotive OS adds vehicle-oriented framework services and the Vehicle HAL. A vehicle property is not simply a network signal: it has identifiers, areas, access modes, change behavior, permissions and availability semantics. The VHAL adapts vehicle-specific interfaces, car services implement platform policy, and applications consume stable APIs. Safety or final actuator authority normally remains in vehicle controllers, not in an HMI application.","Platform customization should use supported APIs, overlays, configuration and bounded vendor services. Deep framework forks increase migration, security and compatibility cost. Common-feature architecture should provide a stable capability model and product-owned presentation without duplicating core services."],"whyItMatters":["AAOS features cross application, framework, vendor and vehicle-controller boundaries.","Clean platform contracts allow several products to share services while preserving vehicle-specific capability and authority."],"inputs":["Customer feature and UX intent","Vehicle property and network contracts","Permission and user/profile model","Android/AOSP baseline","Product variants and compatibility horizon"],"activities":["Trace feature call and data paths","Define AIDL/HAL/API contracts","Allocate policy, adaptation and actuator authority","Design lifecycle, restart and unavailable-data behavior","Test permissions, SELinux, load and compatibility"],"outputs":["AAOS feature architecture","Vehicle-property and permission model","Service lifecycle and failure design","Variant/capability configuration","End-to-end integration and compatibility tests"],"automotiveExample":"A climate application calls a car-service API. The service validates user state and policy, then sends a bounded request through the VHAL adaptation to a body controller. The body controller enforces actuator limits and reports actual state. Product variants declare supported zones rather than forking the service.","commonMistakes":["Mapping raw CAN signals directly into application contracts","Holding locks across synchronous Binder calls","Placing vehicle safety policy in the UI application","Customizing core framework without migration ownership","Showing stale vehicle data without availability semantics"],"relatedConcepts":["embedded-linux-platform","connectivity-infotainment-ota","platform-reuse-variability"],"linkedQuestions":["E06-01","E06-02","E06-03","E06-04","E06-05","E06-06","E06-07","E06-08","E06-09","E06-10"],"references":["Primary platform and processor documentation","AutoLeaP Embedded Systems & Firmware learning baseline"],"source":"content-source/embedded-systems/concepts.json#android-aaos-platform"}
