{"id":"performance-security-release","title":"Performance, Security, Quality and Release Evidence","module":"embedded","collection":"embedded-systems-firmware","order":9,"standard":{"family":"AutoLeaP Embedded Systems Body of Knowledge","edition":"2026","parts":["9"],"clauseRefs":["Performance, Security, Quality and Release"]},"difficulty":"Advanced","stage":9,"systems":["Performance & Reliability","Security & Quality","Technical Management"],"summary":"Performance requirements must define the path, measurement points, workload and distribution. Average utilization does not establish latency or deadline behavior. Boot time, UI response, control loops and connectivity each need budgets and representative operating cases. Long-duration reliability also requires soak, resource-growth and recovery evidence.","learningObjectives":["Build measurable system performance and reliability budgets.","Connect secure boot, isolation, vulnerability and supply-chain controls.","Lead an evidence-based release and residual-risk decision."],"explanation":["Performance requirements must define the path, measurement points, workload and distribution. Average utilization does not establish latency or deadline behavior. Boot time, UI response, control loops and connectivity each need budgets and representative operating cases. Long-duration reliability also requires soak, resource-growth and recovery evidence.","Security controls form a chain. Secure boot authenticates software but does not prove it is vulnerability-free. Runtime isolation constrains damage, key management supports identity and revocation, and a software bill of materials connects releases to dependency risk. Reproducible builds, protected signing and immutable metadata connect approved evidence to the field artifact.","Release readiness combines functionality, integration, timing, security, reliability, update and operational evidence. Deviations and unknowns must be explicit. Schedule pressure may motivate scope reduction, staged release or feature disablement, but it cannot substitute for an acceptability argument. Decision ownership and rollback readiness are part of the release package."],"whyItMatters":["Cross-layer quality problems often remain hidden when each team reports only local green metrics.","A disciplined release model protects customers and makes faster future delivery possible."],"inputs":["Product and non-functional requirements","Build and configuration identity","Test, performance and security evidence","Known defects and deviations","Deployment, rollback and support readiness"],"activities":["Define budgets and release gates","Run static, dynamic, integration and fault tests","Assess dependencies and vulnerabilities","Review residual risk and containment options","Authorize signing, rollout and operational monitoring"],"outputs":["Performance/reliability evidence pack","Security and software-supply-chain record","Release composition and compatibility manifest","Deviation and residual-risk log","Release recommendation and rollback criteria"],"automotiveExample":"A shared platform release shows a severe memory-growth defect on one variant. The review separates affected products, validates containment, and decides to exclude that variant rather than approve a global release. Signing metadata records the eligible composition, and the OTA campaign monitors resource health during staged rollout.","commonMistakes":["Equating signed software with secure software","Using average performance as a release gate","Allowing green activity metrics to hide field escapes","Signing artifacts before evidence approval","Accepting a deviation without owner, expiry and operational control"],"relatedConcepts":["rtos-concurrency-timing","connectivity-infotainment-ota","engineering-product-leadership"],"linkedQuestions":["E09-01","E09-02","E09-03","E09-04","E09-05","E09-06","E09-07","E09-08","E09-09","E09-10"],"references":["Primary platform and processor documentation","AutoLeaP Embedded Systems & Firmware learning baseline"],"source":"content-source/embedded-systems/concepts.json#performance-security-release"}
