{"id":"platform-reuse-variability","title":"Reusable Embedded Platforms and Product Variability","module":"embedded","collection":"embedded-systems-firmware","order":8,"standard":{"family":"AutoLeaP Embedded Systems Body of Knowledge","edition":"2026","parts":["8"],"clauseRefs":["Reusable Platforms and Product Variability"]},"difficulty":"Advanced","stage":8,"systems":["Platform Architecture","Product Ownership"],"summary":"A platform is a governed set of reusable capabilities and contracts with a support commitment. It is not merely a shared repository. Product teams need predictable APIs, compatibility, documentation, integration environments and ownership. Platform teams need clear target products and product feedback. Reuse is valuable when it reduces lead time and risk while preserving product differentiation.","learningObjectives":["Separate platform capability from product-specific behavior.","Design variability, extension and compatibility mechanisms.","Create governance that increases reuse without blocking products."],"explanation":["A platform is a governed set of reusable capabilities and contracts with a support commitment. It is not merely a shared repository. Product teams need predictable APIs, compatibility, documentation, integration environments and ownership. Platform teams need clear target products and product feedback. Reuse is valuable when it reduces lead time and risk while preserving product differentiation.","Commonality should capture stable behavior and infrastructure. Variability should represent legitimate differences in hardware, capability, policy or UX. Configuration selects supported options; extension points allow bounded specialization. Source forks and unscoped conditional compilation usually indicate that variability has not been modeled.","API governance includes source, binary, behavioral, timing and data compatibility. A change that preserves function but alters latency or failure behavior can still break an embedded consumer. Exceptions should be time-bounded, owned and paired with a migration decision. Platform success is measured through product outcomes, adoption, quality and lifecycle cost—not component count."],"whyItMatters":["Poor platform design either blocks product delivery or creates uncontrolled product forks.","A product-family architecture creates option value for future products, suppliers and hardware changes."],"inputs":["Product-family goals and customer differences","Current assets and technical debt","Hardware and supplier variants","Compatibility and support commitments","Product roadmaps and adoption constraints"],"activities":["Identify stable common capabilities","Model variability and unsupported combinations","Define APIs, extension points and version policy","Create platform/product decision rights","Measure adoption, lead time, escapes and migration"],"outputs":["Product-line capability and variability model","Platform API and compatibility policy","Common-feature roadmap","Exception and deprecation process","Platform operating metrics and support model"],"automotiveExample":"Three machine families share connectivity, user identity and update services. A common capability API hides modem and regional differences. Products compose their own HMI and policy. One legacy product receives an adapter with a two-release migration deadline rather than a permanent fork.","commonMistakes":["Maximizing shared code instead of shared product value","Forcing all products into the lowest-common-denominator UX","Adding extension points without ownership and compatibility rules","Allowing exceptions with no expiry","Measuring platform success by library or component count"],"relatedConcepts":["embedded-execution-and-partitioning","android-aaos-platform","engineering-product-leadership"],"linkedQuestions":["E08-01","E08-02","E08-03","E08-04","E08-05","E08-06","E08-07","E08-08","E08-09","E08-10"],"references":["Primary platform and processor documentation","AutoLeaP Embedded Systems & Firmware learning baseline"],"source":"content-source/embedded-systems/concepts.json#platform-reuse-variability"}
