{"id":"connectivity-infotainment-ota","title":"Connectivity, Infotainment and OTA Systems","module":"embedded","collection":"embedded-systems-firmware","order":7,"standard":{"family":"AutoLeaP Embedded Systems Body of Knowledge","edition":"2026","parts":["7"],"clauseRefs":["Connectivity, Infotainment and OTA"]},"difficulty":"Advanced","stage":7,"systems":["Connectivity & OTA","AAOS & Infotainment"],"summary":"Connected embedded products join several asynchronous systems: vehicle networks, modems, cloud services, infotainment pipelines and update infrastructure. Each has different latency, availability and trust assumptions. The architecture should define what operates offline, what data is cached, which commands are permitted, and how a compromised or unavailable domain is contained.","learningObjectives":["Model audio, graphics, vehicle and cloud data paths.","Design authenticated update, staged rollout, rollback and recovery.","Coordinate device, backend and service operations for field reliability."],"explanation":["Connected embedded products join several asynchronous systems: vehicle networks, modems, cloud services, infotainment pipelines and update infrastructure. Each has different latency, availability and trust assumptions. The architecture should define what operates offline, what data is cached, which commands are permitted, and how a compromised or unavailable domain is contained.","OTA is a lifecycle, not a file transfer. Release composition, compatibility metadata, signing, campaign eligibility, download, installation, activation, health monitoring and rollback are one system. Compatibility must be checked both in the backend and on the device because inventory may be stale. Staged cohorts and stop criteria limit blast radius.","Infotainment quality depends on shared-resource behavior. Audio glitches or UI stalls may be caused by modem interrupts, memory pressure, thermal control or storage writeback rather than the visible application. Cross-domain tracing and resource budgets are therefore part of the platform design."],"whyItMatters":["Field update capability determines whether security and product improvements remain sustainable.","Connectivity failures cross organizational boundaries and require product, platform, cloud and operational ownership."],"inputs":["Connected feature and offline requirements","Device/software inventory model","Security and privacy constraints","Network and backend architecture","Service and customer-support workflows"],"activities":["Map trust and data boundaries","Define OTA metadata and compatibility","Design staged rollout and incident controls","Budget shared resources for multimedia/connectivity","Create fleet observability and recovery procedures"],"outputs":["Connected feature architecture","OTA campaign and rollback state model","Gateway and command-authorization rules","Cross-domain performance instrumentation","Operational readiness and incident playbook"],"automotiveExample":"A fleet update targets only vehicles with compatible bootloader and storage layout. Five rollout rings progress from internal to broad customer cohorts. Device health includes boot success, service readiness and critical feature checks. A hardware-specific failure pauses that cohort while unaffected variants continue under controlled policy.","commonMistakes":["Treating TLS as complete connected-vehicle security","Declaring OTA success after download","Relying only on backend compatibility checks","Using feature flags to bypass device-level safety constraints","Debugging multimedia problems only inside the application"],"relatedConcepts":["embedded-linux-platform","android-aaos-platform","performance-security-release"],"linkedQuestions":["E07-01","E07-02","E07-03","E07-04","E07-05","E07-06","E07-07","E07-08","E07-09","E07-10"],"references":["Primary platform and processor documentation","AutoLeaP Embedded Systems & Firmware learning baseline"],"source":"content-source/embedded-systems/concepts.json#connectivity-infotainment-ota"}
